{"$defs":{"commit":{"pattern":"^[0-9a-f]{40}$","type":"string"},"digest":{"pattern":"^[0-9a-f]{64}$","type":"string"},"file":{"additionalProperties":false,"properties":{"byte_count":{"maximum":2000000,"minimum":1,"type":"integer"},"path":{"maxLength":512,"minLength":1,"type":"string"},"sha256":{"$ref":"#/$defs/digest"}},"required":["path","byte_count","sha256"],"type":"object"}},"$schema":"https://json-schema.org/draft/2020-12/schema","additionalProperties":false,"properties":{"accepted_rc1":{"additionalProperties":false,"properties":{"catalog":{"$ref":"#/$defs/file"},"corpus_version":{"const":"career-bench-v1"},"validator":{"$ref":"#/$defs/file"}},"required":["corpus_version","catalog","validator"],"type":"object"},"accepted_rc2":{"additionalProperties":false,"properties":{"contract_version":{"const":"rc2-claude-code-reference-v4"},"registration":{"$ref":"#/$defs/file"},"source_snapshot":{"$ref":"#/$defs/file"},"validator":{"$ref":"#/$defs/file"}},"required":["contract_version","registration","source_snapshot","validator"],"type":"object"},"registration":{"$ref":"#/$defs/file"},"registration_id":{"const":"RC3-REC-DIRECT-2026-08-24-V2"},"runner_files":{"items":{"$ref":"#/$defs/file"},"maxItems":64,"minItems":10,"type":"array","uniqueItems":true},"schema_version":{"const":"1.0"},"snapshot_id":{"const":"RC3-SOURCE-SNAPSHOT-2026-08-24-V2"},"sources":{"items":{"additionalProperties":false,"properties":{"entrypoints":{"items":{"maxLength":160,"minLength":3,"type":"string"},"maxItems":8,"minItems":1,"type":"array","uniqueItems":true},"id":{"maxLength":64,"minLength":3,"type":"string"},"repository":{"pattern":"^https://github.com/OpenCnid/[A-Za-z0-9._-]+$","type":"string"},"revision":{"$ref":"#/$defs/commit"},"version":{"maxLength":64,"minLength":1,"type":"string"}},"required":["id","repository","revision","version","entrypoints"],"type":"object"},"maxItems":3,"minItems":3,"type":"array","uniqueItems":true},"synthetic":{"const":true}},"required":["schema_version","snapshot_id","registration_id","synthetic","registration","accepted_rc1","accepted_rc2","sources","runner_files"],"type":"object"}
