{"accepted_rc1":{"catalog":{"byte_count":6670,"path":"evals/recursus/career-bench-v1/catalog.json","sha256":"279236023eceaa105aa0c13d20c5867d860423f0d6d297c3052074e1ad230200"},"corpus_version":"career-bench-v1","validator":{"byte_count":312,"path":"verify-recursus-benchmark.mjs","sha256":"228040e8a83e0c0b3cf7643ef96e6542c1d1cde37865fb22e99b8272f1d8a5b7"}},"accepted_rc2":{"contract_version":"rc2-claude-code-reference-v4","registration":{"byte_count":4192,"path":"evals/recursus/rc2-claude-code-reference-v4/registration.json","sha256":"28e1e10656d941ab1173f77a6332b0140312b3d55bfb1f8b6d04f3c23a899597"},"source_snapshot":{"byte_count":4411,"path":"evals/recursus/rc2-claude-code-reference-v4/source-snapshot.json","sha256":"8b474dd7c1dbdc276db33b3104e634e804edbbaeaadc43bb70a666d9dbe739ea"},"validator":{"byte_count":1853,"path":"verify-recursus-reference-v4.mjs","sha256":"ac990a72cd0f13bc6268c635f0c3babf2debe2671a965eb2497a2ada8cb448ce"}},"registration":{"byte_count":5113,"path":"evals/recursus/rc3-recursus-direct-v2/registration.json","sha256":"45eedbd423f201659c08ad624f59a96bb1c6a1965772a345412221053881c50c"},"registration_id":"RC3-REC-DIRECT-2026-08-24-V2","runner_files":[{"byte_count":2316,"path":"capture-recursus-route-v2.mjs","sha256":"a95073e1ed15451e846bbce00ae6c4c2e37a560046cdadb1035876a6f8b4e5fc"},{"byte_count":1068,"path":"evals/recursus/rc3-recursus-direct-v2/schemas/artifact-inventory.schema.json","sha256":"7e00731ce084e4123c35468f7a5d3aa213192ab8792c82d9b102fcf472bb56b9"},{"byte_count":736,"path":"evals/recursus/rc3-recursus-direct-v2/schemas/attempt-intent.schema.json","sha256":"2a439d466126d3a8ca115e0184981659854e843144c1a89bc3955fbf2a8e1bfb"},{"byte_count":645,"path":"evals/recursus/rc3-recursus-direct-v2/schemas/attempt-reservation.schema.json","sha256":"f15139d75c942fd5b418999563d62fcacffcea887191e9e108da2976f084aa40"},{"byte_count":2504,"path":"evals/recursus/rc3-recursus-direct-v2/schemas/bridge-input.schema.json","sha256":"d55305b001f09b210c11f50e188fc67f125d42d0e22b3ea91fd1f85d4a682ddd"},{"byte_count":1277,"path":"evals/recursus/rc3-recursus-direct-v2/schemas/ledger-entry.schema.json","sha256":"1c133114299ab8750ecba83deae0d16f4acd90723e55896efeb424fa2c727eb5"},{"byte_count":2382,"path":"evals/recursus/rc3-recursus-direct-v2/schemas/normalized-result.schema.json","sha256":"09feec7c7268e5d68eb97e884fb4f7224526d4bbed56ad2cb62aa384668ec4b6"},{"byte_count":8111,"path":"evals/recursus/rc3-recursus-direct-v2/schemas/registration.schema.json","sha256":"2226909a49ec0c6366382a2907e28fe24b3fadcb41ec1293ba9121ca54a6793e"},{"byte_count":10273,"path":"evals/recursus/rc3-recursus-direct-v2/schemas/runner-manifest.schema.json","sha256":"ca67ead19bd92fbe3f096220abbc3004133649facab394ac7e7743e74efb0e15"},{"byte_count":784,"path":"evals/recursus/rc3-recursus-direct-v2/schemas/seed-inventory.schema.json","sha256":"43f056902ef04b0d7faf6bc7ff5326c200024f8bd18bfa1a4d50750a03cf432a"},{"byte_count":2123,"path":"evals/recursus/rc3-recursus-direct-v2/schemas/source-snapshot.schema.json","sha256":"065307fff79b7450eff631677fd665fa0067d7736ac19c10356e387d6f8371fe"},{"byte_count":994,"path":"evals/recursus/rc3-recursus-direct-v2/schemas/trace.schema.json","sha256":"622318454dab4f90ab26169c411ae5e7f05aebfd848831c3590b977a729601cb"},{"byte_count":1660,"path":"evals/recursus/rc3-recursus-direct-v2/schemas/validation-result.schema.json","sha256":"10fa91c39db403a52f0d23cac84a9c7d402b8ace7cdd85395065151726a78867"},{"byte_count":1122,"path":"evals/recursus/rc3-recursus-direct-v2/schemas/workspace-inventory.schema.json","sha256":"d821aa006d3b4d057bc599063388a2fb41dbdd6d4e7ea7cdce67bd6382cf27ca"},{"byte_count":60658,"path":"lib/recursus-benchmark.mjs","sha256":"769948690b99e00047035126fc3085875e30fd7b5f89df3a7785c8536c3a98b9"},{"byte_count":9103,"path":"lib/recursus-route-capture-v2.mjs","sha256":"c2bfbd459e7c8b5e17cd27f593eb69d61fe533e7bdc9b2fea5f6cd13a3c15002"},{"byte_count":69055,"path":"lib/recursus-route-v2.mjs","sha256":"5e6311c0ac323744d9cdd27048c8ee97a87d46b2d8879443778b3b65bc8d2409"},{"byte_count":14121,"path":"lib/recursus-route-worker-v2.mjs","sha256":"d2920e54d5cc056738975ffa0f6d7290877ef59e9d387847cf4f34af4fc99340"},{"byte_count":3372,"path":"prepare-recursus-route-v2.mjs","sha256":"7d4a42481785ea54bd24cd2cddc9ce16476cfc8885bc160f810a220822b95897"},{"byte_count":1611,"path":"verify-recursus-route-v2.mjs","sha256":"e84ce3c3a40c96a579e2c960b0bde72cd5836d36927cf71bfa9601182d6c0042"}],"schema_version":"1.0","snapshot_id":"RC3-SOURCE-SNAPSHOT-2026-08-24-V2","sources":[{"entrypoints":["@deepseek-ai/dsh-agent","@deepseek-ai/dsh-agent-loop","@deepseek-ai/dsh-credentials-local","@deepseek-ai/dsh-llm"],"id":"deepseek-harness","repository":"https://github.com/OpenCnid/deepseek-harness","revision":"e52c224fe00954fb7e8cda19eb2411dceef15989","version":"dsh-v0.1.0-rc.7"},{"entrypoints":["lib/index.js","OpenAICodexAdapter"],"id":"deepseek-openai-codex","repository":"https://github.com/OpenCnid/deepseek-openai-codex","revision":"5232102d0cc8bd55d5bf27b6eb203efbf6ada8a9","version":"0.1.0"},{"entrypoints":["packages/assembly/lib/index.js","scripts/manage-profile.mjs"],"id":"recursus","repository":"https://github.com/OpenCnid/recursus","revision":"4444405e8b34124b1518fa2a66d0223e202234e4","version":"0.0.0-foundation"}],"synthetic":true}
